{
  "pack_id": "ch04",
  "version": "3.0.0-generated",
  "objectiveIds": [
    "1.1",
    "1.2"
  ],
  "modules": [
    {
      "id": "ch04-ch004",
      "title": "Acknowledgments",
      "tag_ids": [],
      "objectiveIds": [
        "1.1",
        "1.2"
      ],
      "pages": [
        {
          "id": "ch04-ch004-s000",
          "title": "Acknowledgments",
          "objectiveIds": [
            "1.1",
            "1.2"
          ],
          "content_blocks": [],
          "checks": [],
          "cards": [
            {
              "id": "ch04-c004-s000-k000",
              "text": "Acknowledgments: Books like this involve work from many people, and as authors, we truly appreciate the hard work and dedication that the team at Wiley shows. We would especially like to thank Senior Acquisitions Editor Kenyon Brown. We have…",
              "interaction_type": "mcq",
              "interaction_payload": {
                "prompt": "Regarding \"Acknowledgments\": which statement is most accurate?",
                "options": [
                  "Books like this involve work from many people, and as authors, we truly appreciate the hard work and dedication that the team at Wiley shows. We would especially like to thank Senior Acquisitions…",
                  "It is functionally identical to role-based access control.",
                  "It operates primarily at the physical layer of the OSI model.",
                  "It encrypts the payload but leaves the headers in plaintext."
                ],
                "correct_index": 0,
                "explanation": "Key fact: \"Books like this involve work from many people, and as authors, we truly appreciate the hard work and dedication that the team at Wiley shows. We would especially like to thank Senior Acquisitions…\""
              },
              "objectiveIds": [
                "1.1",
                "1.2"
              ]
            },
            {
              "id": "ch04-c004-s000-k001",
              "text": "Acknowledgments: We owe a great debt of gratitude to Runzhi “Tom” Song, Mike's research assistant at Notre Dame. Tom's assistance with the instructional materials that accompany this book was invaluable.",
              "interaction_type": "mcq",
              "interaction_payload": {
                "prompt": "Regarding \"Acknowledgments\": which statement is most accurate?",
                "options": [
                  "It requires manual intervention from a systems administrator.",
                  "We owe a great debt of gratitude to Runzhi “Tom” Song, Mike's research assistant at Notre Dame. Tom's assistance with the instructional materials that accompany this book was invaluable.",
                  "It decreases overall security but improves network latency.",
                  "It is a preventative control designed to block traffic implicitly."
                ],
                "correct_index": 1,
                "explanation": "Key fact: \"We owe a great debt of gratitude to Runzhi “Tom” Song, Mike's research assistant at Notre Dame. Tom's assistance with the instructional materials that accompany this book was invaluable.\""
              },
              "objectiveIds": [
                "1.1",
                "1.2"
              ]
            },
            {
              "id": "ch04-c004-s000-k002",
              "text": "Acknowledgments: We also greatly appreciate the editing and production team for this book, including Lily Miller, our project editor, who brought years of experience and great talent to the project; Chris Crayton, our technical editor, and Shahla…",
              "interaction_type": "mcq",
              "interaction_payload": {
                "prompt": "Regarding \"Acknowledgments\": which statement is most accurate?",
                "options": [
                  "It encrypts the payload but leaves the headers in plaintext.",
                  "It is only applicable to on-premises deployments, not the cloud.",
                  "It is functionally identical to role-based access control.",
                  "We also greatly appreciate the editing and production team for this book, including Lily Miller, our project editor, who brought years of experience and great talent to the project; Chris Crayton,…"
                ],
                "correct_index": 3,
                "explanation": "Key fact: \"We also greatly appreciate the editing and production team for this book, including Lily Miller, our project editor, who brought years of experience and great talent to the project; Chris Crayton,…\""
              },
              "objectiveIds": [
                "1.1",
                "1.2"
              ]
            },
            {
              "id": "ch04-c004-s000-k003",
              "text": "Acknowledgments: Our agent, Carole Jelen of Waterside Productions, continues to provide us with wonderful opportunities, advice, and assistance throughout our writing careers.",
              "interaction_type": "mcq",
              "interaction_payload": {
                "prompt": "Regarding \"Acknowledgments\": which statement is most accurate?",
                "options": [
                  "It is only applicable to on-premises deployments, not the cloud.",
                  "It operates primarily at the physical layer of the OSI model.",
                  "Our agent, Carole Jelen of Waterside Productions, continues to provide us with wonderful opportunities, advice, and assistance throughout our writing careers.",
                  "It is a preventative control designed to block traffic implicitly."
                ],
                "correct_index": 2,
                "explanation": "Key fact: \"Our agent, Carole Jelen of Waterside Productions, continues to provide us with wonderful opportunities, advice, and assistance throughout our writing careers.\""
              },
              "objectiveIds": [
                "1.1",
                "1.2"
              ]
            },
            {
              "id": "ch04-c004-s000-k004",
              "text": "Acknowledgments: Finally, we would like to thank our families and significant others who support us through the late evenings, busy weekends, and long hours that a book like this requires to write, edit, and get to press.",
              "interaction_type": "mcq",
              "interaction_payload": {
                "prompt": "Regarding \"Acknowledgments\": which statement is most accurate?",
                "options": [
                  "It is a preventative control designed to block traffic implicitly.",
                  "It operates primarily at the physical layer of the OSI model.",
                  "It relies solely on symmetric encryption for all its transactions.",
                  "Finally, we would like to thank our families and significant others who support us through the late evenings, busy weekends, and long hours that a book like this requires to write, edit, and get to…"
                ],
                "correct_index": 3,
                "explanation": "Key fact: \"Finally, we would like to thank our families and significant others who support us through the late evenings, busy weekends, and long hours that a book like this requires to write, edit, and get to…\""
              },
              "objectiveIds": [
                "1.1",
                "1.2"
              ]
            }
          ]
        }
      ]
    },
    {
      "id": "ch04-ch012",
      "title": "Chapter 4 Social Engineering and Password Attacks",
      "tag_ids": [],
      "objectiveIds": [
        "1.1",
        "1.2"
      ],
      "pages": [
        {
          "id": "ch04-ch012-s000",
          "title": "Chapter 4 Social Engineering and Password Attacks",
          "objectiveIds": [
            "1.1",
            "1.2"
          ],
          "content_blocks": [],
          "checks": [],
          "cards": [
            {
              "id": "ch04-c012-s000-k000",
              "text": "Chapter 4 Social Engineering and Password Attacks: THE COMPTIA SECURITY+ EXAM OBJECTIVES COVERED IN THIS CHAPTER INCLUDE:",
              "interaction_type": "tap_to_highlight",
              "interaction_payload": {
                "text": "THE COMPTIA SECURITY+ EXAM OBJECTIVES COVERED IN THIS CHAPTER INCLUDE:",
                "spans": [
                  {
                    "start": 0,
                    "end": 20,
                    "label": "THE COMPTIA SECURITY"
                  }
                ],
                "target_span_labels": [
                  "THE COMPTIA SECURITY"
                ],
                "explanation": "Key concepts in this Chapter 4 Social Engineering and Password Attacks."
              },
              "objectiveIds": [
                "1.1",
                "1.2"
              ]
            },
            {
              "id": "ch04-c012-s000-k001",
              "text": "Chapter 4 Social Engineering and Password Attacks: Domain 2.0: Threats, Vulnerabilities, and Mitigations 2.2. Explain common threat vectors and attack surfaces. Human vectors/social engineering (Phishing, Vishing, Smishing,…",
              "interaction_type": "tap_to_highlight",
              "interaction_payload": {
                "text": "Domain 2.0: Threats, Vulnerabilities, and Mitigations 2.2. Explain common threat vectors and attack surfaces. Human vectors/social engineering (Phishing, Vishing, Smishing, Misinformation/disinformation, Impersonation, Business email compromise, Pretexting, Watering hole, Brand impersonation, Typosquatting).",
                "spans": [
                  {
                    "start": 124,
                    "end": 142,
                    "label": "social engineering"
                  },
                  {
                    "start": 144,
                    "end": 152,
                    "label": "Phishing"
                  }
                ],
                "target_span_labels": [